C8: 2005 January Jaunt Results Event Report Overall Results Detailed Results Event Report The Jaunt proved to be a challenge for all again this year, with a stellar turnout of 23 cars. 3 Experts, 6 Intermediates, one Open class car, and a whopping 13 Novices were in the starting field. The road conditions were good winter conditions, with a hard-packed snow and soft ice base, covered by a few centimeters of fresh snow delivered by the rally gods on the morning of the event. The conditions were good, with good traction, but managed to catch out one crew running on all-season tires. New this year was the introduction of an Open class, for competitors who wanted to get in some practice before other winter rallies by running Novice instructions. While there was interest, there wasn't sufficient interest this year for the class, so the Open competitors opted to run in Novice class instead to be eligible for awards. The results really show that a good challenge was provided. A number of cars missed one or more checkpoints (so don't feel bad if you were one of them), and a couple of cars decided that Leg A was long enough for various reasons. We still had 20 finishers, although two of the cars decided to cut route and head to the finish (one due to mechanical difficulties). The results were posted around 10:37 PM, and finalized at 10:50 PM. The finalized results are included with this report; they are formatted differently, but reflect the results as posted (including errors), with the exception that the Leg A scores for cars 4 and 5 have been included. The results are presented in 3 tables: the first is a summary with overall and total scores, sorted by finishing position within class. The second and third tables present detailed scores for each leg including totals, sorted by car number for (hopefully) easier lookup. For interest, the rank for each car by class (for that leg only) is included in these tables. Some adjustments were made during scoring, to reflect the situation on the road. Checkpoints A10 and B7 were not placed, so they were left out of the scoring (everyone scored a zero at those checkpoints, and the ET was added to the next checkpoint when calculating the score). B8 was originally going to be timed to the minute, but since cars on the road would have thought B8 was B7, it was timed to the second instead. In addition, the timing instructions told competitors to travel at 72 kph in a 60 kph zone for several km in section B3 - since this was not legally possible, checkpoing B6 was scored as "route in time out", meaning you scored a zero if you hit the checkpoint, but still were scored a miss (and the ET used for scoring the next checkpoint) if you missed it. Also, maximum lateness was not calculated, and was not scored (it counts as a missed checkpoint). Maximum lateness occurs when your total lateness less your early scores totals 30 minutes or more (or 60 minutes at the finish). I mentioned above that there were some errors in the results (this is the first time I've used this scoring spreadsheet, and a couple of bugs crept in). After results are declared final, it is simply not appropriate to alter any scores, so these results are posted with errors (I stated I was going to make an exception to this for cars 4 and 5). If you look closely at the results, you can see the occasional checkpoint timed to the minute where there was a timed to the second score - these really should have been rounded to the more beneficial score for the competitor. You can also see that some scores are above 15; the maximum score you can have when you show up at a checkpoint is 15, and maximum scores were not calculated. But fixing these errors would not affect the overall standings - only some competitors might feel more comfortable with a lower score, rather than just winning their position. From an organizer's view there were a couple of new things that we tried, and that worked quite well. One of our primary objectives was to track lost cars and ensure that we knew where everyone was. Dietmar and I used a ham radio net for the first time on this rally, and that proved most useful for this. We also recorded contact info for competitors on the entry form (i.e. cell phone numbers), and actually used this information to track down one competitor who was lost. Overall, I'd call this year's Jaunt a success. Dietmar and I would like to thank all the People who put in a lot of hard work, and suffered through various levels of frustration: The rally just doesn't run without a great worker team like this. But we'd especially like to thank all the competitors for coming out to play in the snow and making our hard work a success. We hope to see all of you on Saturday, January 7th, 2006 for the next January Jaunt! Kurt Seelenmayer VA3KSE Co-Organizer, 2005 January Jaunt Overall Results Detailed Results
A11: © 2003-2024Kurt Seelenmayer | C11: Last updated: 2024-01-08

B1: January Jaunt Navigational Car Rally

A1: Chris Atkins | B1: Checkpoint | C1: Neils Jensen Jr | D1: Checkpoint
A2: Nick & Ingrid Beck | B2: Registration & Checkpoint | C2: Paul & Rita Moore | D2: Checkpoint & Greencrew
A3: Peter & Margaret Fenwick | B3: Checkpoint & Finish | C3: Rich & Eloise Sullivan | D3: Checkpoint & Leg A Finish/B Start
A4: Paul Henshall | B4: Checkpoint & ORRC Steward | C4: Marianne von Cube | D4: Checkpoint

A1: Car # | B1: Class | C1: Driver | D1: Club | E1: Navigator | F1: Club | G1: Car | H1: Leg A Total | I1: Leg B Total | J1: Total | K1: Position | L1: Car #
A2: 20 | B2: E | C2: Garth Thompson | D2: MLRC | E2: Brooke Jacobs | F2: TAC | G2: Red 2003 BMW Mini Cooper S | H2: 3.1 | I2: 2.3 | J2: =I2+H2 -> 5.4 | K2: =CONCATENATE(ROW()-1," ",B2) -> 1 E | L2: =A2 -> 20
A3: 10 | B3: E | C3: Bryn Epp | D3: MLRC | E3: Terry Epp | F3: MLRC | G3: White 1996 Chevrolet Cavalier | H3: 6.7 | I3: 5.4 | J3: =I3+H3 -> 12.1 | K3: =CONCATENATE(ROW()-1," ",B3) -> 2 E | L3: =A3 -> 10
A4: 15 | B4: E | C4: Peter Clifford | D4: TAC | E4: John Charles | F4: TAC | G4: Silver 2001 Hyundai Accent GSi | H4: 16.1 | I4: 37.5 | J4: =I4+H4 -> 53.6 | K4: =CONCATENATE(ROW()-1," ",B4) -> 3 E | L4: =A4 -> 15
A6: 3 | B6: I | C6: Paul Leonard | D6: KWRC | E6: Dave Jones | F6: MLRC | G6: Green 2003 Subaru Impreza | H6: 4.4 | I6: 4.5 | J6: =I6+H6 -> 8.9 | K6: =CONCATENATE(ROW()-5," ",B6) -> 1 I | L6: =A6 -> 3
A7: 12 | B7: I | C7: Prem Radzikowski | D7: KWRC | E7: Michael Lumsden | F7: - | G7: BLUE 2000 SUBARU RS | H7: 1.8 | I7: 14.0 | J7: =I7+H7 -> 15.8 | K7: =CONCATENATE(ROW()-5," ",B7) -> 2 I | L7: =A7 -> 12
A8: 2 | B8: I | C8: Roger Sanderson | D8: KWRC | E8: Christina Chinn | F8: KWRC | G8: Red 2002 BMW Mini | H8: 14.4 | I8: 7.800000000000006 | J8: =I8+H8 -> 22.2 | K8: =CONCATENATE(ROW()-5," ",B8) -> 3 I | L8: =A8 -> 2
A9: 21 | B9: I | C9: Joh. Friedrich | D9: KWRC | E9: Ryan Huber | F9: MCO | G9: Red 2003 Chrysler PTCruiser | H9: 0.99999999999999856 | I9: 24.8 | J9: =I9+H9 -> 25.8 | K9: =CONCATENATE(ROW()-5," ",B9) -> 4 I | L9: =A9 -> 21
A10: 22 | B10: I | C10: Ken Nazeer | D10: MLRC | E10: Nathan Mekuz | F10: - | G10: Red 1994 Subaru Legacy | H10: 22.2 | I10: 8.4 | J10: =I10+H10 -> 30.6 | K10: =CONCATENATE(ROW()-5," ",B10) -> 5 I | L10: =A10 -> 22
A11: 23 | B11: I | C11: Vyacheslav Inozemtsev | D11: - | E11: Ilya Inozemtsev | F11: - | G11: Brown 1999 Subaru Legacy Wagon | H11: 75.0 | I11: 77.4 | J11: =I11+H11 -> 152.4 | K11: =CONCATENATE(ROW()-5," ",B11) -> 6 I | L11: =A11 -> 23
A13: 24 | B13: N | C13: William Horne | D13: - | E13: Roustem Semitov | F13: - | G13: Silver 1993 Mazda 626 | H13: 6.0000000000000053 | I13: 10.5 | J13: =I13+H13 -> 16.5 | K13: =CONCATENATE(ROW()-12," ",B13) -> 1 N | L13: =A13 -> 24
A14: 11 | B14: N | C14: Toby Link | D14: - | E14: Cynthia Lee | F14: - | G14: White 1989 Honda Civic | H14: 15.1 | I14: 10.4 | J14: =I14+H14 -> 25.5 | K14: =CONCATENATE(ROW()-12," ",B14) -> 2 N | L14: =A14 -> 11
A15: 9 | B15: N | C15: Robinson Kelly | D15: MLRC | E15: Sheena Disher | F15: - | G15: White 1993 Toyota Celica | H15: 26.6 | I15: 8.9 | J15: =I15+H15 -> 35.5 | K15: =CONCATENATE(ROW()-12," ",B15) -> 3 N | L15: =A15 -> 9
A16: 8 | B16: N | C16: Kevin Young | D16: MLRC | E16: Stephen Rodger | F16: MLRC | G16: Blue 2004 Subaru STi | H16: 28.7 | I16: 24.2 | J16: =I16+H16 -> 52.9 | K16: =CONCATENATE(ROW()-12," ",B16) -> 4 N | L16: =A16 -> 8
A17: 13 | B17: N | C17: Anthony Tremblay | D17: MLRC | E17: Sebastien Barre | F17: MLRC | G17: White 1990 HOnda CRX | H17: 23.9 | I17: 33.0 | J17: =I17+H17 -> 56.9 | K17: =CONCATENATE(ROW()-12," ",B17) -> 5 N | L17: =A17 -> 13
A18: 17 | B18: N | C18: Tudor Horia | D18: MLRC | E18: Mihai Chriac | F18: MLRC | G18: Blue 2002 Subaru Impreza WRX | H18: 70.8 | I18: 9.1 | J18: =I18+H18 -> 79.9 | K18: =CONCATENATE(ROW()-12," ",B18) -> 6 N | L18: =A18 -> 17
A19: 16 | B19: N | C19: Susan McAuley | D19: TAC | E19: Sarah McAuley | F19: TAC | G19: Black 2002 Dodge Durango | H19: 49.1 | I19: 43.8 | J19: =I19+H19 -> 92.9 | K19: =CONCATENATE(ROW()-12," ",B19) -> 7 N | L19: =A19 -> 16
A20: 18 | B20: N | C20: Frank de Kat | D20: KWRC | E20: Rebecca Sargeant | F20: - | G20: White 1986 Audi 4000 Quattro | H20: 8.0 | I20: 124.1 | J20: =I20+H20 -> 132.1 | K20: =CONCATENATE(ROW()-12," ",B20) -> 8 N | L20: =A20 -> 18
A21: 19 | B21: N | C21: Andrew Vernon | D21: TAC | E21: Kyle Waldner | F21: - | G21: Silver 2000 Ford Focus | H21: 95.2 | I21: 70.9 | J21: =I21+H21 -> 166.1 | K21: =CONCATENATE(ROW()-12," ",B21) -> 9 N | L21: =A21 -> 19
A22: 1 | B22: N | C22: Yasunori Aoki | D22: - | E22: Anna Phan | F22: - | G22: Blue 2000 Subaru Impreza RS2.5 | H22: 39.6 | I22: 142.2 | J22: =I22+H22 -> 181.8 | K22: =CONCATENATE(ROW()-12," ",B22) -> 10 N | L22: =A22 -> 1
A23: 4 | B23: N | C23: Jane Lennox | D23: MCO | E23: Adam Dowsett | F23: KWRC | G23: Blue 2000 Audi TT | H23: 29.1 | I23: DNS | J23: DNF | L23: =A23 -> 4
A24: 5 | B24: N | C24: Bob Becker | D24: TAC | E24: Andrew Becker | F24: TAC | G24: Beige 1994 Toyota Previa | H24: 83.0 | I24: DNS | J24: DNF | L24: =A24 -> 5
A25: 7 | B25: N | C25: Mike deBruin | D25: - | E25: Paul Driegen | F25: - | G25: White 2004 Subaru Impreza WRX | H25: DNF | I25: DNF | J25: DNF | L25: =A25 -> 7
A27: 14 | B27: O | C27: Jason Ehler | D27: - | E27: Ali Ansari | F27: - | G27: Burgundy 1994 VW Jetta | H27: 90.4 | I27: 18.8 | J27: =I27+H27 -> 109.2 | K27: =CONCATENATE(ROW()-26," ",B27) -> 1 O | L27: =A27 -> 14
A28: 6 | B28: X | J28: DNR | L28: =A28 -> 6

A1: Car # | B1: Class | C1: A1 | D1: A2 | E1: A3 | F1: A4 | G1: A5 | H1: A6 | I1: A7 | J1: A8 | K1: A9 | L1: A10 | M1: A11 | N1: A12 | O1: A13 | P1: Total | Q1: Leg A Rank
A2: 1 | B2: N | C2: -2 | D2: 1.4 | E2: -0.70000000000000107 | F2: 0.0 | G2: 0.0 | H2: -0.80000000000000071 | I2: 1.5 | J2: -1 | K2: 0 | L2: 0 | M2: 3.2 | N2: 20 | O2: -9 | P2: 39.6 | Q2: 8 N
A3: 2 | B3: I | C3: -2 | D3: 0.29999999999999716 | E3: 0.29999999999999893 | F3: 0.6 | G3: 0.1 | H3: 0.30000000000000071 | I3: 5.9 | J3: -1 | K3: 0 | L3: 0 | M3: 1.3 | N3: 2.6 | O3: 0 | P3: 14.4 | Q3: 4 I
A4: 3 | B4: I | C4: 0.30000000000000071 | D4: -0.10000000000000142 | E4: 0.5 | F4: 0.1 | G4: 0.2 | H4: 0.0 | I4: 0.70000000000000107 | J4: 0 | K4: 0 | L4: 0 | M4: 2.4 | N4: 0.10000000000000142 | O4: 0 | P4: 4.4 | Q4: 3 I
A5: 4 | B5: N | C5: -2 | D5: 0.5 | E5: 0.0 | F5: 0.5 | G5: 0.1 | H5: -0.59999999999999787 | I5: -0.19999999999999929 | J5: -1 | K5: 0 | L5: 0 | M5: 3.8 | N5: 20 | O5: -0.39999999999999858 | P5: 29.1 | Q5: 7 N
A6: 5 | B6: N | C6: 1 | D6: 0.39999999999999858 | E6: 20 | F6: 2.3 | G6: 0.5 | H6: 0.30000000000000071 | I6: 1.5 | J6: -1 | K6: -1 | L6: 0 | M6: 20 | N6: 20 | O6: 15 | P6: 83.0 | Q6: 11 N
A7: 6 | B7: X | P7: DNR
A8: 7 | B8: N | P8: DNF
A9: 8 | B9: N | C9: 1 | D9: 1.3 | E9: 0.19999999999999929 | F9: 0.8 | G9: 0.0 | H9: -0.19999999999999929 | I9: 1.5 | J9: -1 | K9: 0 | L9: 0 | M9: 11.4 | N9: 2.3 | O9: -9 | P9: 28.7 | Q9: 6 N
A10: 9 | B10: N | C10: 4 | D10: -0.10000000000000142 | E10: -1.0 | F10: 1.0 | G10: 0.0 | H10: 0.0 | I10: 0.0 | J10: 0 | K10: -1 | L10: 0 | M10: 16.4 | N10: -9.9999999999997868E-2 | O10: 3 | P10: 26.6 | Q10: 5 N
A11: 10 | B11: E | C11: 1 | D11: 0.39999999999999858 | E11: -0.20000000000000107 | F11: 0.3 | G11: 0.0 | H11: 0.0 | I11: -9.9999999999999645E-2 | J11: 0 | K11: 0 | L11: 0 | M11: 1.3 | N11: 3.4 | O11: 0 | P11: 6.7 | Q11: 2 E
A12: 11 | B12: N | C12: 1 | D12: -0.20000000000000284 | E12: -0.20000000000000107 | F12: 0.5 | G12: 0.1 | H12: -0.59999999999999787 | I12: -0.19999999999999929 | J12: 0 | K12: -1 | L12: 0 | M12: 3.0 | N12: 0.30000000000000071 | O12: -8 | P12: 15.1 | Q12: 3 N
A13: 12 | B13: I | C13: 0 | D13: 0.19999999999999929 | E13: -0.30000000000000071 | F13: 0.2 | G13: 0.0 | H13: -0.30000000000000071 | I13: 9.9999999999999645E-2 | J13: 0 | K13: 0 | L13: 0 | M13: 0.59999999999999787 | N13: -9.9999999999997868E-2 | O13: 0 | P13: 1.8 | Q13: 2 I
A14: 13 | B14: N | C14: 1 | D14: 1.8 | E14: 2.4 | F14: 1.8 | G14: -0.2 | H14: 3.0 | I14: 1.7 | J14: 0 | K14: 1 | L14: 0 | M14: 2.4 | N14: 1.6 | O14: -7 | P14: 23.9 | Q14: 4 N
A15: 14 | B15: O | C15: 1 | D15: 0.0 | E15: -0.5 | F15: 1.1 | G15: 0.1 | H15: 1.5 | I15: 3.4 | J15: -1 | K15: 1 | L15: 0 | M15: 20 | N15: 20 | O15: 40.8 | P15: 90.4 | Q15: 1 O
A16: 15 | B16: E | C16: 0 | D16: 0.79999999999999716 | E16: 0.79999999999999893 | F16: 0.4 | G16: -0.3 | H16: -9.5 | I16: 0.70000000000000107 | J16: 2 | K16: 0 | L16: 0 | M16: 1.0 | N16: 0.60000000000000142 | O16: 0 | P16: 16.1 | Q16: 3 E
A17: 16 | B17: N | C17: -4 | D17: 4.2 | E17: -0.30000000000000071 | F17: -0.2 | G17: 0.4 | H17: 4.0 | I17: 2.3 | J17: -1 | K17: 1 | L17: 0 | M17: 17.6 | N17: 6.1 | O17: -8 | P17: 49.1 | Q17: 9 N
A18: 17 | B18: N | C18: -1 | D18: 0.0 | E18: 0.0 | F18: 0.2 | G18: -0.2 | H18: -0.30000000000000071 | I18: 3.3 | J18: 0 | K18: 0 | L18: 0 | M18: 20 | N18: 20 | O18: 25.8 | P18: 70.8 | Q18: 10 N
A19: 18 | B19: N | C19: -2 | D19: 0.59999999999999787 | E19: 0.0 | F19: 0.9 | G19: 0.1 | H19: 1.0 | I19: 9.9999999999999645E-2 | J19: 0 | K19: 0 | L19: 0 | M19: 2.7 | N19: 0.60000000000000142 | O19: 0 | P19: 8.0 | Q19: 2 N
A20: 19 | B20: N | C20: 9 | D20: 20 | E20: 20 | F20: -1.4000000000000057 | G20: 0.2 | H20: 0.0 | I20: 0.80000000000000071 | J20: -1 | K20: 0 | L20: 0 | M20: 20 | N20: 20 | O20: 2.8 | P20: 95.2 | Q20: 12 N
A21: 20 | B21: E | C21: 0 | D21: 1.2 | E21: 0.0 | F21: 0.0 | G21: -0.1 | H21: -0.80000000000000071 | I21: 0.70000000000000107 | J21: 0 | K21: 0 | L21: 0 | M21: -0.10000000000000142 | N21: -0.19999999999999929 | O21: 0 | P21: 3.1 | Q21: 1 E
A22: 21 | B22: I | C22: 0 | D22: 0.29999999999999716 | E22: -9.9999999999999645E-2 | F22: 0.0 | G22: -0.1 | H22: 0.0 | I22: 9.9999999999999645E-2 | J22: 0 | K22: 0 | L22: 0 | M22: -0.10000000000000142 | N22: 0.30000000000000071 | O22: 0 | P22: 0.99999999999999856 | Q22: 1 I
A23: 22 | B23: I | C23: -1 | D23: 9.9999999999997868E-2 | E23: 0.0 | F23: 0.2 | G23: 0.0 | H23: 0.0 | I23: 0.20000000000000107 | J23: 0 | K23: 0 | L23: 0 | M23: -0.10000000000000142 | N23: 20 | O23: 0.60000000000000142 | P23: 22.2 | Q23: 5 I
A24: 23 | B24: I | C24: 2 | D24: 0.79999999999999716 | E24: -0.70000000000000107 | F24: 0.0 | G24: -0.2 | H24: 8.3 | I24: 0.20000000000000107 | J24: 1 | K24: 0 | L24: 0 | M24: 20 | N24: 20 | O24: 21.8 | P24: 75.0 | Q24: 6 I
A25: 24 | B25: N | C25: 0 | D25: -0.70000000000000284 | E25: -0.5 | F25: 0.5 | G25: 0.0 | H25: -0.5 | I25: 0.6 | J25: 0 | K25: -2 | L25: 0 | M25: 0.5 | N25: 0.70000000000000284 | O25: 0 | P25: 6.0000000000000053 | Q25: 1 N
A28: Car # | B28: Class | C28: B1 | D28: B2 | E28: B3 | F28: B4 | G28: B5 | H28: B6 | I28: B7 | J28: B8 | K28: B9 | L28: B10 | M28: Total | N28: Leg B Rank
A29: 1 | B29: N | C29: -0.60000000000000142 | D29: 20 | E29: 20 | F29: 20 | G29: 20 | H29: 20 | I29: 0 | J29: 20 | K29: 20 | L29: 1.6 | M29: 142.2 | N29: 10 N
A30: 2 | B30: I | C30: -0.20000000000000107 | D30: 0.20000000000000284 | E30: 0 | F30: 1.6 | G30: 0.4 | H30: 0 | I30: 0 | J30: 1.4 | K30: 4 | L30: 0 | M30: 7.800000000000006 | N30: 2 I
A31: 3 | B31: I | C31: -0.60000000000000142 | D31: -1.4 | E31: 1 | F31: 9.9999999999999645E-2 | G31: 0.2 | H31: 0 | I31: 0 | J31: -0.19999999999999929 | K31: -1 | L31: 0 | M31: 4.5 | N31: 1 I
A32: 4 | B32: N | M32: DNS
A33: 5 | B33: N | M33: DNS
A34: 6 | B34: X | M34: DNR
A35: 7 | B35: N | M35: DNF
A36: 8 | B36: N | C36: -3.2 | D36: 16.2 | E36: 0.6 | F36: 0.19999999999999929 | G36: 0.3 | H36: 0 | I36: 0 | J36: 2.7 | K36: -1 | L36: 0 | M36: 24.2 | N36: 5 N
A37: 9 | B37: N | C37: -0.5 | D37: -0.29999999999999716 | E37: 8 | F37: 0.0 | G37: 0.0 | H37: 0 | I37: 0 | J37: -9.9999999999997868E-2 | K37: 0 | L37: 0 | M37: 8.9 | N37: 1 N
A38: 10 | B38: E | C38: -0.70000000000000107 | D38: 2.9 | E38: 0 | F38: -0.20000000000000107 | G38: 0.3 | H38: 0 | I38: 0 | J38: 1.3 | K38: 0 | L38: 0 | M38: 5.4 | N38: 2 E
A39: 11 | B39: N | C39: -0.10000000000000142 | D39: -1.3 | E39: 2 | F39: 0.29999999999999893 | G39: 1.7 | H39: 0 | I39: 0 | J39: 3.0 | K39: -2 | L39: 0 | M39: 10.4 | N39: 3 N
A40: 12 | B40: I | C40: -2.0 | D40: -0.5 | E40: 9 | F40: 0.0 | G40: 9.9999999999999645E-2 | H40: 0 | I40: 0 | J40: -0.39999999999999858 | K40: -2 | L40: 0 | M40: 14.0 | N40: 4 I
A41: 13 | B41: N | C41: -0.4 | D41: 1.1 | E41: 2 | F41: 1.2 | G41: 0.5 | H41: 0 | I41: 0 | J41: 7.8 | K41: 20 | L41: 0 | M41: 33.0 | N41: 6 N
A42: 14 | B42: O | C42: 9.4 | D42: -0.5 | E42: 1 | F42: -0.9 | G42: 0.2 | H42: 0 | I42: 0 | J42: -2.8 | K42: -2 | L42: 2 | M42: 18.8 | N42: 1 O
A43: 15 | B43: E | C43: 2.0 | D43: 0.40000000000000213 | E43: 0 | F43: 0.69999999999999929 | G43: 0.9 | H43: 0 | I43: 0 | J43: 4.5 | K43: 20 | L43: 9 | M43: 37.5 | N43: 3 E
A44: 16 | B44: N | C44: 3.6 | D44: -0.19999999999999929 | E44: 4 | F44: 1.9 | G44: 3.1 | H44: 0 | I44: 0 | J44: 0.0 | K44: 20 | L44: 11 | M44: 43.8 | N44: 7 N
A45: 17 | B45: N | C45: -3.3 | D45: -1.2 | E45: -3 | F45: -0.20000000000000107 | G45: 0.0 | H45: 0 | I45: 0 | J45: -0.39999999999999858 | K45: -1 | L45: 0 | M45: 9.1 | N45: 2 N
A46: 18 | B46: N | C46: 1.9 | D46: -1.7 | E46: 2 | F46: 20 | G46: 20 | H46: 20 | I46: 0 | J46: 20 | K46: 20 | L46: 18.5 | M46: 124.1 | N46: 9 N
A47: 19 | B47: N | C47: 0.39999999999999858 | D47: 3.2 | E47: 1 | F47: -0.70000000000000107 | G47: 0.3 | H47: 20 | I47: 0 | J47: 20 | K47: 20 | L47: 5.3 | M47: 70.9 | N47: 8 N
A48: 20 | B48: E | C48: 0.0 | D48: 0.0 | E48: 2 | F48: 0.0 | G48: 0.3 | H48: 0 | I48: 0 | J48: 0.0 | K48: 0 | L48: 0 | M48: 2.3 | N48: 1 E
A49: 21 | B49: I | C49: 20 | D49: -1.9 | E49: 1 | F49: 0.0 | G49: 0.2 | H49: 0 | I49: 0 | J49: -0.69999999999999929 | K49: -1 | L49: 0 | M49: 24.8 | N49: 5 I
A50: 22 | B50: I | C50: 0.0 | D50: 0.10000000000000142 | E50: 1 | F50: 0.0 | G50: 9.9999999999999645E-2 | H50: 0 | I50: 0 | J50: 7.2 | K50: 0 | L50: 0 | M50: 8.4 | N50: 3 I
A51: 23 | B51: I | C51: 1.9 | D51: 12.0 | E51: 2 | F51: 0.89999999999999858 | G51: 0.6 | H51: 20 | I51: 0 | J51: 20 | K51: 20 | L51: 0 | M51: 77.4 | N51: 6 I
A52: 24 | B52: N | C52: 0.69999999999999929 | D52: 7.2 | E52: 0 | F52: -0.20000000000000107 | G52: 0.0 | H52: 0 | I52: 0 | J52: 0.40000000000000213 | K52: 2 | L52: 0 | M52: 10.5 | N52: 4 N